{
  "schemaVersion": 1,
  "project": {
    "name": "golden-express-app"
  },
  "runtime": {
    "id": "node"
  },
  "packageManager": "pnpm",
  "framework": {
    "id": "express",
    "options": {
      "typescript": true
    }
  },
  "integrations": [
    { "id": "postgresql" },
    { "id": "prisma" },
    { "id": "zod" },
    { "id": "vitest" },
    { "id": "prettier" }
  ]
}
