{
  "schemaVersion": 1,
  "project": {
    "name": "golden-fastapi-app"
  },
  "runtime": {
    "id": "python"
  },
  "packageManager": "uv",
  "framework": {
    "id": "fastapi"
  },
  "integrations": [
    { "id": "pydantic" },
    { "id": "postgresql" },
    { "id": "sqlalchemy" },
    { "id": "alembic" },
    { "id": "pytest" },
    { "id": "ruff" }
  ]
}
