{
  "schemaVersion": 1,
  "project": {
    "name": "golden-ui-app"
  },
  "runtime": {
    "id": "node"
  },
  "packageManager": "pnpm",
  "framework": {
    "id": "nextjs",
    "options": {
      "typescript": true
    }
  },
  "integrations": [
    {
      "id": "tailwind"
    },
    {
      "id": "shadcn"
    }
  ]
}
