{
  "schemaVersion": 1,
  "project": {
    "name": "example-flask-app"
  },
  "runtime": {
    "id": "python"
  },
  "packageManager": "uv",
  "framework": {
    "id": "flask"
  },
  "integrations": [
    { "id": "postgresql" },
    { "id": "sqlalchemy" },
    { "id": "alembic" },
    { "id": "pytest" },
    { "id": "ruff" },
    { "id": "docker" },
    { "id": "docker-compose" }
  ]
}
